{
  "_id": "pln_lanes",
  "_rev": "2-corpus",
  "created_at": "2026-10-22T09:00:00Z",
  "executed_run_token": 0,
  "execution_authority": "daemon",
  "execution_owner": null,
  "last_executed_at": "2026-10-22T10:00:00Z",
  "last_finalized_execution": {
    "execution_id": "20261022T100000000000Z_0001",
    "failure_policy": "continue_independent",
    "finalized_at": "2026-10-22T10:00:00Z",
    "outcome": "failed",
    "plan_generation": "6f41ef9b55dd15f40e1b25f536e6661b",
    "plan_id": "pln_lanes",
    "report": {
      "counts": {
        "blocked": 1,
        "failed": 1,
        "reused": 0,
        "succeeded": 2,
        "unreached": 0
      },
      "diagnostic": null,
      "direct_blockers": {
        "lane1_upload": [
          "lane1_demux"
        ]
      },
      "ended_at": "2026-10-22T10:00:00Z",
      "execution_id": "20261022T100000000000Z_0001",
      "failed_ancestors": {
        "lane1_upload": [
          "lane1_demux"
        ]
      },
      "failure_policy": "continue_independent",
      "failures": {
        "lane1_demux": {
          "advice": "Correct the sample sheet, then regenerate the plan.",
          "code": "SAMPLESHEET_DUPLICATE_LANE",
          "error": "lane 1 is listed twice in the sample sheet",
          "error_type": "PermanentStepError",
          "kind": "permanent",
          "step_id": "lane1_demux"
        }
      },
      "is_drained": true,
      "outcome": "failed",
      "plan_generation": "6f41ef9b55dd15f40e1b25f536e6661b",
      "plan_id": "pln_lanes",
      "publication_failure": null,
      "run_token": 0,
      "started_at": "2026-10-22T10:00:00Z",
      "step_ids": [
        "lane1_demux",
        "lane1_upload",
        "lane2_demux",
        "lane2_upload"
      ],
      "step_outcomes": {
        "lane1_demux": "failed",
        "lane1_upload": "blocked",
        "lane2_demux": "succeeded",
        "lane2_upload": "succeeded"
      },
      "termination_reason": "completed",
      "unreached_step_ids": []
    },
    "run_token": 0,
    "termination_reason": "completed"
  },
  "plan": {
    "failure_policy": "continue_independent",
    "plan_id": "pln_lanes",
    "realm": "test_realm",
    "scope": {
      "id": "P1",
      "kind": "project"
    },
    "steps": [
      {
        "deps": [],
        "fn_ref": "tests.execution:scripted",
        "inputs": {},
        "name": "lane1_demux",
        "outputs": {},
        "params": {},
        "scope": {},
        "step_id": "lane1_demux"
      },
      {
        "deps": [
          "lane1_demux"
        ],
        "fn_ref": "tests.execution:scripted",
        "inputs": {},
        "name": "lane1_upload",
        "outputs": {},
        "params": {},
        "scope": {},
        "step_id": "lane1_upload"
      },
      {
        "deps": [],
        "fn_ref": "tests.execution:scripted",
        "inputs": {},
        "name": "lane2_demux",
        "outputs": {},
        "params": {},
        "scope": {},
        "step_id": "lane2_demux"
      },
      {
        "deps": [
          "lane2_demux"
        ],
        "fn_ref": "tests.execution:scripted",
        "inputs": {},
        "name": "lane2_upload",
        "outputs": {},
        "params": {},
        "scope": {},
        "step_id": "lane2_upload"
      }
    ]
  },
  "plan_generation": "6f41ef9b55dd15f40e1b25f536e6661b",
  "preview": {},
  "realm": "test_realm",
  "run_token": 0,
  "schema_version": 1,
  "scope": {
    "id": "P1",
    "kind": "project"
  },
  "status": "approved",
  "updated_at": "2026-10-22T10:00:00Z"
}
