{
  "_id": "pln_lifecycle",
  "_rev": "3-corpus",
  "created_at": "2026-10-22T09:00:00Z",
  "executed_run_token": -1,
  "execution_authority": "daemon",
  "execution_owner": null,
  "plan": {
    "failure_policy": "fail_fast",
    "plan_id": "pln_lifecycle",
    "realm": "test_realm",
    "scope": {
      "id": "P1",
      "kind": "project"
    },
    "steps": [
      {
        "deps": [],
        "fn_ref": "tests.execution:scripted",
        "inputs": {},
        "name": "demux",
        "outputs": {},
        "params": {
          "lanes": [
            1,
            2
          ]
        },
        "scope": {},
        "step_id": "demux"
      },
      {
        "deps": [
          "demux"
        ],
        "fn_ref": "tests.execution:scripted",
        "inputs": {},
        "name": "qc",
        "outputs": {},
        "params": {
          "min_reads": 1000
        },
        "scope": {},
        "step_id": "qc"
      }
    ]
  },
  "plan_generation": "ea571dafed95ede0b6192f271281e3c0",
  "preview": {},
  "realm": "test_realm",
  "run_token": 0,
  "schema_version": 1,
  "scope": {
    "id": "P1",
    "kind": "project"
  },
  "status": "draft",
  "updated_at": "2026-10-23T08:00:00Z"
}
